{
	"languageName": "CubicalTT",
	"constantPrefix": "CUBICAL_TT",
	"exeName": "cubical",
	"runConfigInit": "",
	"trimVersion": "version.trim()",
	"supportsParsing": true,
	"highlightTokenPairs": {
		"KEYWORD": "KEYWORD",
		"IDENTIFIER": "IDENTIFIER",
		"COMMA": "COMMA",
		"PAREN": "PARENTHESES",
		"BRACK": "BRACKETS",
		"SEMICOLON": "SEMICOLON",
		"LINE_COMMENT": "LINE_COMMENT",
		"BLOCK_COMMENT": "BLOCK_COMMENT",
		"FUNCTION_NAME": "FUNCTION_DECLARATION",
		"DATATYPE_NAME": "CLASS_NAME",
		"UNDEFINED": "KEYWORD",
		"HOLE": "LABEL",
		"DIMENSION": "NUMBER",
		"PROJECTION": "INSTANCE_FIELD"
	},
	"keywordList": [
		"transparentAll",
		"transparent",
		"transport",
		"undefined",
		"import",
		"module",
		"mutual",
		"opaque",
		"split@",
		"unglue",
		"hComp",
		"hdata",
		"PathP",
		"split",
		"where",
		"comp",
		"data",
		"fill",
		"glue",
		"Glue",
		"with",
		"id",
		"id",
		"let",
		"Id",
		"in"
	]
}