{
	"languageName": "Mlang",
	"constantPrefix": "M_LANG",
	"exeName": "mlang.jar",
	"generateCliState": false,
	"supportsParsing": true,
	"highlightTokenPairs": {
		"KEYWORD": "KEYWORD",
		"IDENTIFIER": "IDENTIFIER",
		"COMMA": "COMMA",
		"PAREN": "PARENTHESES",
		"BRACE": "BRACES",
		"BRACK": "BRACKETS",
		"LINE_COMMENT": "LINE_COMMENT",
		"BLOCK_COMMENT": "BLOCK_COMMENT",
		"FUNCTION_NAME": "FUNCTION_DECLARATION",
		"DIMENSION": "NUMBER"
	}
}